{
  "schema_version": 1,
  "relation_id": "rel_tw_harbor_precedes_market_to_customs",
  "relation_type": "precedes",
  "from_id": "kb_tw_harbor_market_square_event",
  "to_id": "kb_tw_harbor_customs_gate_beat",
  "label": "Market inquiry precedes customs gate inspection",
  "revision": 2,
  "created_at": "2026-07-23T08:15:00Z",
  "updated_at": "2026-07-23T08:15:00Z",
  "extensions": {}
}
