{
  "schema_version": 1,
  "relation_id": "rel_tw_harbor_precedes_customs_to_berth",
  "relation_type": "precedes",
  "from_id": "kb_tw_harbor_customs_gate_beat",
  "to_id": "kb_tw_harbor_berth_confirm_event",
  "label": "Customs inspection precedes berth confirmation",
  "revision": 1,
  "created_at": "2026-07-23T08:15:00Z",
  "updated_at": "2026-07-23T08:15:00Z",
  "extensions": {}
}
