{
  "schema_version": 1,
  "relation_id": "rel_tw_mira_harbor",
  "relation_type": "located_in",
  "from_id": "kb_tw_mira",
  "to_id": "kb_tw_harbor",
  "label": "Mira is at Harbor Town",
  "revision": 1,
  "created_at": "2026-07-23T06:15:00Z",
  "updated_at": "2026-07-23T06:15:00Z",
  "extensions": {}
}
